{"$id":"urn:lima:v4:lima.stage-attempt","$schema":"https://json-schema.org/draft/2020-12/schema","additionalProperties":false,"properties":{"attempt_number":{"minimum":1,"type":"integer"},"failure_kind":{"oneOf":[{"enum":["environment","tool_error","timeout","out_of_memory","policy_denied","internal"],"type":"string"},{"type":"null"}]},"inputs":{"items":{"properties":{"artifact_id":{"pattern":"^[A-Za-z0-9][A-Za-z0-9._:-]{0,127}$","type":"string"},"content_digest":{"pattern":"^[0-9a-f]{64}$","type":"string"},"kind":{"enum":["lima.repository-profile","lima.audit-evidence-package","lima.vulnerability-evidence-package","lima.repair-verification-report","lima.workflow","lima.stage-attempt"],"type":"string"},"schema_version":{"pattern":"^4\\.[0-9]+$","type":"string"}},"required":["kind","artifact_id","content_digest","schema_version"],"type":"object"},"maxItems":64,"type":"array"},"outputs":{"items":{"properties":{"artifact_id":{"pattern":"^[A-Za-z0-9][A-Za-z0-9._:-]{0,127}$","type":"string"},"content_digest":{"pattern":"^[0-9a-f]{64}$","type":"string"},"kind":{"enum":["lima.repository-profile","lima.audit-evidence-package","lima.vulnerability-evidence-package","lima.repair-verification-report","lima.workflow","lima.stage-attempt"],"type":"string"},"schema_version":{"pattern":"^4\\.[0-9]+$","type":"string"}},"required":["kind","artifact_id","content_digest","schema_version"],"type":"object"},"maxItems":64,"type":"array"},"skip_reason":{"oneOf":[{"enum":["by_request","by_policy"],"type":"string"},{"type":"null"}]},"stage_attempt_id":{"pattern":"^[A-Za-z0-9][A-Za-z0-9._:-]{0,127}$","type":"string"},"stage_type":{"enum":["profile","audit","mine","repair","summarize"],"type":"string"},"status":{"enum":["not_started","running","succeeded","skipped","blocked","failed","cancelled"],"type":"string"},"workflow_id":{"pattern":"^[A-Za-z0-9][A-Za-z0-9._:-]{0,127}$","type":"string"}},"required":["attempt_number","failure_kind","inputs","outputs","skip_reason","stage_attempt_id","stage_type","status","workflow_id"],"title":"lima.stage-attempt","type":"object"}