[{"attempt_number":1,"failure_kind":null,"inputs":[{"artifact_id":"profile-0001","content_digest":"ad7d53a0ed22412dbbfc60d0ed9183d7e939e2d14e4eee2d9399944cb5c4dccc","kind":"lima.repository-profile","schema_version":"4.0"}],"outputs":[{"artifact_id":"aep-0001","content_digest":"f0a985432ebd11dc4b85897653cf443dc2c0b0312e453424648ebc2d164705d0","kind":"lima.audit-evidence-package","schema_version":"4.0"}],"skip_reason":null,"stage_attempt_id":"attempt-audit-0001","stage_type":"audit","status":"succeeded","workflow_id":"workflow-0001"},{"attempt_number":1,"failure_kind":"environment","inputs":[{"artifact_id":"aep-0001","content_digest":"f0a985432ebd11dc4b85897653cf443dc2c0b0312e453424648ebc2d164705d0","kind":"lima.audit-evidence-package","schema_version":"4.0"}],"outputs":[],"skip_reason":null,"stage_attempt_id":"attempt-mine-0001","stage_type":"mine","status":"blocked","workflow_id":"workflow-0001"},{"attempt_number":2,"failure_kind":"tool_error","inputs":[{"artifact_id":"vep-0001","content_digest":"cd76622b48d11c0300e63d7489701479c75dc2f4b06cc6c4e88af1f453061d01","kind":"lima.vulnerability-evidence-package","schema_version":"4.0"}],"outputs":[],"skip_reason":null,"stage_attempt_id":"attempt-repair-0002","stage_type":"repair","status":"failed","workflow_id":"workflow-0001"},{"attempt_number":1,"failure_kind":null,"inputs":[],"outputs":[],"skip_reason":"by_request","stage_attempt_id":"attempt-mine-skip-0001","stage_type":"mine","status":"skipped","workflow_id":"workflow-0001"}]